{
  "actors": [
    {
      "actor_id": "red25",
      "aliases": [
        "红二十五军",
        "部队"
      ],
      "confidence": 1,
      "evidence_refs": [
        "ev_01"
      ],
      "name": "红二十五军"
    },
    {
      "actor_id": "eyuwan_shengwei",
      "aliases": [],
      "confidence": 0.95,
      "evidence_refs": [
        "ev_06"
      ],
      "name": "中共鄂豫皖省委"
    },
    {
      "actor_id": "eyushan_shengwei",
      "aliases": [],
      "confidence": 0.95,
      "evidence_refs": [
        "ev_18"
      ],
      "name": "中共鄂豫陕省委"
    },
    {
      "actor_id": "kmt_40army_115bde",
      "aliases": [],
      "confidence": 0.9,
      "evidence_refs": [
        "ev_32"
      ],
      "name": "国民党第四十军第一一五旅"
    },
    {
      "actor_id": "kmt_60div",
      "aliases": [],
      "confidence": 0.9,
      "evidence_refs": [
        "ev_33"
      ],
      "name": "国民党第六十师"
    },
    {
      "actor_id": "dongbeijun",
      "aliases": [],
      "confidence": 0.85,
      "evidence_refs": [
        "ev_45"
      ],
      "name": "东北军"
    },
    {
      "actor_id": "xibeijun",
      "aliases": [],
      "confidence": 0.85,
      "evidence_refs": [
        "ev_45"
      ],
      "name": "西北军"
    },
    {
      "actor_id": "shaanxi_local",
      "aliases": [],
      "confidence": 0.85,
      "evidence_refs": [
        "ev_45"
      ],
      "name": "陕西地方部队"
    },
    {
      "actor_id": "shaanxi_jingbeilv",
      "aliases": [],
      "confidence": 0.9,
      "evidence_refs": [
        "ev_35"
      ],
      "name": "陕军警备第一旅"
    },
    {
      "actor_id": "kmt_38army",
      "aliases": [],
      "confidence": 0.9,
      "evidence_refs": [
        "ev_37"
      ],
      "name": "陕军第三十八军"
    },
    {
      "actor_id": "hu_zongnan",
      "aliases": [],
      "confidence": 0.9,
      "evidence_refs": [
        "ev_37"
      ],
      "name": "胡宗南部"
    },
    {
      "actor_id": "chuanjun",
      "aliases": [],
      "confidence": 0.85,
      "evidence_refs": [
        "ev_37"
      ],
      "name": "川军一部"
    },
    {
      "actor_id": "wang_jun_3army",
      "aliases": [],
      "confidence": 0.9,
      "evidence_refs": [
        "ev_38"
      ],
      "name": "王均第三军"
    },
    {
      "actor_id": "lu_dachang_14div",
      "aliases": [],
      "confidence": 0.9,
      "evidence_refs": [
        "ev_38"
      ],
      "name": "鲁大昌第十四师"
    },
    {
      "actor_id": "mao_bingwen_37army",
      "aliases": [],
      "confidence": 0.9,
      "evidence_refs": [
        "ev_39"
      ],
      "name": "毛炳文第三十七军"
    },
    {
      "actor_id": "ma_hongbin_35div",
      "aliases": [],
      "confidence": 0.9,
      "evidence_refs": [
        "ev_40"
      ],
      "name": "马鸿宾第三十五师"
    },
    {
      "actor_id": "red26",
      "aliases": [],
      "confidence": 0.9,
      "evidence_refs": [
        "ev_29"
      ],
      "name": "红二十六军"
    },
    {
      "actor_id": "red27",
      "aliases": [],
      "confidence": 0.9,
      "evidence_refs": [
        "ev_29"
      ],
      "name": "红二十七军"
    },
    {
      "actor_id": "shangan_red",
      "aliases": [],
      "confidence": 0.95,
      "evidence_refs": [
        "ev_28"
      ],
      "name": "陕甘红军"
    },
    {
      "actor_id": "red15corps",
      "aliases": [],
      "confidence": 0.95,
      "evidence_refs": [
        "ev_29"
      ],
      "name": "红十五军团"
    }
  ],
  "callouts": [
    {
      "anchor_ref": "evt_meeting_yujiahe",
      "anchor_ref_type": "event",
      "body": "1934年12月10日，中共鄂豫皖省委在庾家河召开会议，决定创建鄂豫陕革命根据地。此后红二十五军在鄂豫陕边区进行了持续数月的往返转战。",
      "callout_id": "callout_yujiahe",
      "image_enabled": false,
      "image_path": "",
      "leader_style": "straight",
      "preferred_side": "right_top",
      "priority": 10,
      "template": "text_only",
      "title": "庾家河会议",
      "width_mm": 42
    },
    {
      "anchor_ref": "evt_meeting_fengyukou",
      "anchor_ref_type": "event",
      "body": "1935年7月15日，中共鄂豫陕省委在沣峪口召开会议，决定红二十五军继续西征北上。7月16日部队从沣峪口出发，沿秦岭地区向西行进。",
      "callout_id": "callout_fengyukou",
      "image_enabled": false,
      "image_path": "",
      "leader_style": "straight",
      "preferred_side": "right_top",
      "priority": 10,
      "template": "text_only",
      "title": "沣峪口会议",
      "width_mm": 42
    },
    {
      "anchor_ref": "evt_rendezvous_yongping",
      "anchor_ref_type": "event",
      "body": "1935年9月15日红二十五军到达永坪镇，9月16日与陕甘红军会师，红二十五军长征至此结束。此后与红二十六军、红二十七军合编为红十五军团。",
      "callout_id": "callout_yongping",
      "image_enabled": false,
      "image_path": "",
      "leader_style": "straight",
      "preferred_side": "right_top",
      "priority": 10,
      "template": "text_only",
      "title": "永坪会师",
      "width_mm": 42
    }
  ],
  "events": [
    {
      "actor_refs": [
        "red25"
      ],
      "confidence": 1,
      "description": "红二十五军从河南省罗山县何家冲出发，开始向西实行战略转移",
      "event_id": "evt_departure_hejiachong",
      "event_type": "departure",
      "evidence_refs": [
        "ev_01"
      ],
      "location_ref": "se_hejiachong",
      "name": "何家冲出发",
      "priority": 10,
      "time_text": "1934年11月16日"
    },
    {
      "actor_refs": [
        "red25"
      ],
      "confidence": 1,
      "event_id": "evt_arrival_dushu",
      "event_type": "arrival",
      "evidence_refs": [
        "ev_02"
      ],
      "location_ref": "se_dushu",
      "name": "到达独树镇七里岗",
      "time_text": "1934年11月26日"
    },
    {
      "actor_refs": [
        "red25",
        "kmt_40army_115bde"
      ],
      "confidence": 1,
      "description": "红二十五军在独树镇同堵截部队发生激战，突出重围",
      "event_id": "evt_battle_dushu",
      "event_type": "battle",
      "evidence_refs": [
        "ev_03"
      ],
      "location_ref": "se_dushu",
      "name": "独树镇战斗",
      "priority": 9,
      "time_text": "1934年11月26日"
    },
    {
      "actor_refs": [
        "red25"
      ],
      "confidence": 0.95,
      "description": "红二十五军攻破豫陕交界的铁锁关",
      "event_id": "evt_battle_tiesuoguan",
      "event_type": "battle",
      "evidence_refs": [
        "ev_04"
      ],
      "location_ref": "se_tiesuoguan",
      "name": "攻破铁锁关",
      "priority": 8,
      "time_text": "1934年12月8日"
    },
    {
      "actor_refs": [
        "red25"
      ],
      "confidence": 1,
      "event_id": "evt_arrival_yujiahe",
      "event_type": "arrival",
      "evidence_refs": [
        "ev_05"
      ],
      "location_ref": "se_yujiahe",
      "name": "到达庾家河",
      "time_text": "1934年12月9日"
    },
    {
      "actor_refs": [
        "red25"
      ],
      "confidence": 0.95,
      "description": "部队在庾家河一带作战",
      "event_id": "evt_battle_yujiahe",
      "event_type": "battle",
      "evidence_refs": [
        "ev_06"
      ],
      "location_ref": "se_yujiahe",
      "name": "庾家河战斗",
      "priority": 8,
      "time_text": "1934年12月10日"
    },
    {
      "actor_refs": [
        "eyuwan_shengwei"
      ],
      "confidence": 1,
      "description": "中共鄂豫皖省委召开会议，决定创建鄂豫陕革命根据地",
      "event_id": "evt_meeting_yujiahe",
      "event_type": "meeting",
      "evidence_refs": [
        "ev_06"
      ],
      "location_ref": "se_yujiahe",
      "name": "庾家河会议",
      "priority": 10,
      "time_text": "1934年12月10日"
    },
    {
      "actor_refs": [
        "red25"
      ],
      "confidence": 0.9,
      "event_id": "evt_battle_caiyuyao",
      "event_type": "battle",
      "evidence_refs": [
        "ev_10"
      ],
      "location_ref": "se_caiyuyao",
      "name": "蔡玉窑战斗",
      "priority": 7,
      "time_text": "1935年初"
    },
    {
      "actor_refs": [
        "red25"
      ],
      "confidence": 0.9,
      "event_id": "evt_battle_wengongling",
      "event_type": "battle",
      "evidence_refs": [
        "ev_10"
      ],
      "location_ref": "se_wengongling",
      "name": "文公岭战斗",
      "priority": 7,
      "time_text": "1935年初"
    },
    {
      "actor_refs": [
        "red25"
      ],
      "confidence": 1,
      "description": "红二十五军在袁家沟口取得重要战斗胜利",
      "event_id": "evt_battle_yuangjiagoukou",
      "event_type": "battle",
      "evidence_refs": [
        "ev_16"
      ],
      "location_ref": "se_yuangjiagoukou",
      "name": "袁家沟口战斗",
      "priority": 9,
      "time_text": "1935年7月2日"
    },
    {
      "actor_refs": [
        "eyushan_shengwei"
      ],
      "confidence": 1,
      "description": "中共鄂豫陕省委在沣峪口召开会议，决定红二十五军继续西征北上",
      "event_id": "evt_meeting_fengyukou",
      "event_type": "meeting",
      "evidence_refs": [
        "ev_18"
      ],
      "location_ref": "se_fengyukou",
      "name": "沣峪口会议",
      "priority": 10,
      "time_text": "1935年7月15日"
    },
    {
      "actor_refs": [
        "red25"
      ],
      "confidence": 1,
      "event_id": "evt_departure_fengyukou",
      "event_type": "departure",
      "evidence_refs": [
        "ev_19"
      ],
      "location_ref": "se_fengyukou",
      "name": "从沣峪口出发西征",
      "time_text": "1935年7月16日"
    },
    {
      "actor_refs": [
        "red25"
      ],
      "confidence": 0.9,
      "description": "部队在天水北关一带作战",
      "event_id": "evt_battle_tianshui",
      "event_type": "battle",
      "evidence_refs": [
        "ev_22"
      ],
      "location_ref": "se_tianshui",
      "name": "天水北关战斗",
      "priority": 7,
      "time_text": "1935年7月底后"
    },
    {
      "actor_refs": [
        "red25",
        "ma_hongbin_35div"
      ],
      "confidence": 1,
      "description": "红二十五军在泾川县四坡村同国民党军发生激战",
      "event_id": "evt_battle_sipo",
      "event_type": "battle",
      "evidence_refs": [
        "ev_24"
      ],
      "location_ref": "se_sipo",
      "name": "四坡村战斗",
      "priority": 9,
      "time_text": "1935年8月21日"
    },
    {
      "actor_refs": [
        "red25"
      ],
      "confidence": 1,
      "event_id": "evt_arrival_yongping",
      "event_type": "arrival",
      "evidence_refs": [
        "ev_27"
      ],
      "location_ref": "se_yongping",
      "name": "到达永坪镇",
      "time_text": "1935年9月15日"
    },
    {
      "actor_refs": [
        "red25",
        "shangan_red"